{
  "lane": "persona",
  "run": {
    "target_url": "http://localhost:3000",
    "task_list": "test/fixtures/tasks.json",
    "personas": [
      "free-tier-user"
    ]
  },
  "personas": [
    {
      "name": "free-tier-user",
      "tool_call_count": 312,
      "run_status": "completed"
    }
  ],
  "findings": []
}
