{
  "lane": "persona",
  "run": {
    "target_url": "http://localhost:3000",
    "task_list": "test/fixtures/tasks.json",
    "personas": [
      "free-tier-user",
      "willing-to-pay-user",
      "vp-team-buyer"
    ]
  },
  "run_status": "completed",
  "personas": [
    {
      "name": "free-tier-user",
      "run_status": "completed",
      "start_ts": "2026-07-08T09:00:00.000Z",
      "end_ts": "2026-07-08T09:04:30.000Z"
    },
    {
      "name": "willing-to-pay-user",
      "run_status": "completed",
      "start_ts": "2026-07-08T09:00:05.000Z",
      "end_ts": "2026-07-08T09:04:10.000Z"
    },
    {
      "name": "vp-team-buyer",
      "run_status": "completed",
      "start_ts": "2026-07-08T09:00:02.000Z",
      "end_ts": "2026-07-08T09:04:50.000Z"
    }
  ],
  "findings": []
}
